CODCNH,NOMBRE,DIRECCION,TELEFONO,TELEFONO2,TELEFAX,CODMU,MUNICIPIOS,CODPROV,PROVINCIAS,CODAUTO,COMUNIDADES,CODPOSTAL,NCAMAS,CODFI,FINALIDAD ASISITENCIAL,CODPAT,DEPENDENCIA PATRIMONIAL,CODFU,DEPENDENCIA FUNCIONAL,ACREDOCENT,ESCOMPLE,FORCOMPLE,CODIDCOM,ALTA,CERRADO,CAPITAL,CIERREFECH,CONCIERTO,EMAIL,TAC,RM,GAM,HEM,ASD,LIT,BCO,ALI,SPECT,PET,MAMOS,DO,DIAL,address,location,point,Latitude,Longitude,Altitude
330156,HOSPITAL DE CABUEÑES,"LOS PRADOS, 395",985185000.0,,985367169.0,330241,Gijón,33,ASTURIAS,3,PPDO. DE ASTURIAS,033394,457,1,GENERAL,1,SEGURIDAD SOCIAL,26,SERVICIO DE SALUD DEL PRINCIPADO DE ASTURIAS-SESPA,S,N,N,,N,N,N,,N,gerencia.gae5@sespa.es,2,2,0,1,0,0,0,0,0,0,1,0,23,"LOS PRADOS, 395,Gijón,033394","Camino de los Prados 395, Gijón, Principado de Asturias 33394, Spain","(43.5235687, -5.6064987, 0.0)",43.5235687,-5.6064987,0.0
330169,HOSPITAL DE LA CRUZ ROJA,"URÍA, 37",985195000.0,,985133195.0,330241,Gijón,33,ASTURIAS,3,PPDO. DE ASTURIAS,033202,120,12,MÉDICO-QUIRÚRGICO,11,PRIVADO-BENÉFICO (CRUZ ROJA),20,PRIVADO-BENÉFICO (CRUZ ROJA),N,N,N,,N,N,N,,S,correo@hospitalcrgijon.com,0,0,0,0,0,0,0,0,0,0,3,0,15,"URÍA, 37,Gijón,033202","Calle de Uría 37, Gijón, Principado de Asturias 33202, Spain","(43.5383857, -5.6549024, 0.0)",43.5383857,-5.6549024,0.0
330175,SANATORIO NUESTRA SEÑORA DE COVADONGA,"GENERAL SUÁREZ VALDÉS, 40",985365122.0,984395070.0,985130758.0,330241,Gijón,33,ASTURIAS,3,PPDO. DE ASTURIAS,033204,24,12,MÉDICO-QUIRÚRGICO,12,PRIVADO-BENÉFICO (IGLESIA),21,PRIVADO-BENÉFICO (IGLESIA),N,N,N,,N,N,N,,N,gerente@sanatoriocovadonga.com,0,1,0,0,0,0,0,0,0,0,0,0,0,"GENERAL SUÁREZ VALDÉS, 40,Gijón,033204","Calle del General Suárez Valdés 40, Gijón, Principado de Asturias 33204, Spain","(43.5302469, -5.648888, 0.0)",43.5302469,-5.648888,0.0
330194,FUNDACIÓN HOSPITAL DE JOVE,"AV. EDUARDO CASTRO, 161",985320308.0,985320050.0,985315710.0,330241,Gijón,33,ASTURIAS,3,PPDO. DE ASTURIAS,033290,233,1,GENERAL,13,OTRO PRIVADO BENÉFICO,22,OTRO PRIVADO-BENÉFICO,S,N,N,,N,N,N,,S,direcciondegestion@hospitaldejove.com,1,1,0,0,0,1,0,2,0,1,1,0,19,"AV. EDUARDO CASTRO, 161,Gijón,033290","Avenida de Eduardo Castro 161, Gijón, Principado de Asturias 33290, Spain","(43.547163128832736, -5.699130734569749, 0.0)",43.547163128832736,-5.699130734569749,0.0
330208,"HOSPITAL BEGOÑA DE GIJÓN, S.L.","PABLO IGLESIAS, 92",985367711.0,,985365385.0,330241,Gijón,33,ASTURIAS,3,PPDO. DE ASTURIAS,033204,41,1,GENERAL,14,PRIVADO NO BENÉFICO,23,PRIVADO NO BENÉFICO,N,N,N,,N,N,N,,N,gerencia@hospitalbegona.com,1,1,0,0,0,0,0,0,0,0,1,1,0,"PABLO IGLESIAS, 92,Gijón,033204","Avenida de Pablo Iglesias 92, Gijón, Principado de Asturias 33204, Spain","(43.5352394, -5.6478063, 0.0)",43.5352394,-5.6478063,0.0
330241,HOSPITAL VALLE DEL NALÓN,POLÍGONO DE RIAÑO,985652000.0,,985652006.0,330313,Langreo,33,ASTURIAS,3,PPDO. DE ASTURIAS,033920,223,1,GENERAL,1,SEGURIDAD SOCIAL,26,SERVICIO DE SALUD DEL PRINCIPADO DE ASTURIAS-SESPA,N,N,N,,N,N,N,,N,gerente.gae8@sespa.princast.es,1,1,0,0,0,0,0,0,0,0,1,0,9,"POLÍGONO DE RIAÑO,Langreo,033920","Polígono de Riaño, Langreo, Principado de Asturias 33920, Spain","(43.3237105001031, -5.72197935040292, 0.0)",43.3237105001031,-5.72197935040292,0.0
330254,FUNDACIÓN SANATORIO ADARO,"JOVE Y CANELLA, 1",985681754.0,,985692151.0,330313,Langreo,33,ASTURIAS,3,PPDO. DE ASTURIAS,033900,138,13,GERIATRÍA Y/O LARGA ESTANCIA,13,OTRO PRIVADO BENÉFICO,22,OTRO PRIVADO-BENÉFICO,N,N,N,,N,N,N,,S,gerencia@sanatorioadaro.com,0,0,0,0,0,0,0,0,0,0,1,0,0,"JOVE Y CANELLA, 1,Langreo,033900","Calle de José María Jové y Canella, Langreo, Principado de Asturias 33900, Spain","(43.2917614744416, -5.67528239022548, 0.0)",43.2917614744416,-5.67528239022548,0.0
330267,HOSPITAL V. ÁLVAREZ BUYLLA,"VISTALEGRE-SANTULLANO,2",985458500.0,,985458509.0,330371,Mieres,33,ASTURIAS,3,PPDO. DE ASTURIAS,033611,176,1,GENERAL,1,SEGURIDAD SOCIAL,26,SERVICIO DE SALUD DEL PRINCIPADO DE ASTURIAS-SESPA,S,N,N,,N,N,N,,N,gerencia.area7@sespa.es,1,1,0,0,0,0,0,0,0,0,1,0,16,"VISTALEGRE-SANTULLANO,2,Mieres,033611","Calle de la Fábrica de Mieres 2, Mieres, Principado de Asturias 33600, Spain","(43.25486768203929, -5.777105266635168, 0.0)",43.25486768203929,-5.777105266635168,0.0
330292,HOSPITAL UNIVERSITARIO CENTRAL DE ASTURIAS,"AVDA. ROMA, S/N  LA CORREDORIA",985108000.0,,985108703.0,330447,Oviedo,33,ASTURIAS,3,PPDO. DE ASTURIAS,033011,991,1,GENERAL,9,ENTIDADES PÚBLICAS,26,SERVICIO DE SALUD DEL PRINCIPADO DE ASTURIAS-SESPA,S,N,N,,N,N,S,,N,gerencia.area4@sespa.es,6,5,3,2,4,1,0,4,3,1,2,2,36,"AVDA. ROMA, S/N  LA CORREDORIA,Oviedo,033011","Oviedo, Principality of Asturias, Spain","(43.387840270996094, -5.826907157897949, 0.0)",43.387840270996094,-5.826907157897949,0.0
330306,HOSPITAL DEL ORIENTE DE ASTURIAS FRANCISCO GRANDE COVIÁN,"LA CASTAÑERA, S/N",985840032.0,985843722.0,985841550.0,330450,Parres,33,ASTURIAS,3,PPDO. DE ASTURIAS,033540,90,1,GENERAL,6,COMUNIDAD AUTÓNOMA,26,SERVICIO DE SALUD DEL PRINCIPADO DE ASTURIAS-SESPA,S,N,N,,N,N,N,,N,gerencia.area6@sespa.es,1,0,0,0,0,0,0,0,0,0,1,0,8,"LA CASTAÑERA, S/N,Parres,033540","Parres, Principality of Asturias, Spain","(43.38836669921875, -5.186789035797119, 0.0)",43.38836669921875,-5.186789035797119,0.0
330313,HOSPITAL DE LUARCA -ASISTENCIA MÉDICA OCCIDENTALSL,VILLAR S/N- LUARCA,985470707.0,,985470737.0,330349,Valdés,33,ASTURIAS,3,PPDO. DE ASTURIAS,033700,19,14,OTROS MONOGRÁFICOS,14,PRIVADO NO BENÉFICO,23,PRIVADO NO BENÉFICO,N,N,N,,N,N,N,,N,amosl@grupomelca.com,0,0,0,0,0,0,0,0,0,0,0,0,0,"VILLAR S/N- LUARCA,Valdés,033700","Luarca, Principality of Asturias, Spain","(43.54232406616211, -6.536066055297852, 0.0)",43.54232406616211,-6.536066055297852,0.0
330321,"INSTITUTO SALUD MENTAL PÉREZ-ESPINOSA ORIA, S.L.","LG SANTA ROSA, Nº 6",985771677.0,,985772566.0,330352,Llanera,33,ASTURIAS,3,PPDO. DE ASTURIAS,033690,42,6,PSIQUIÁTRICO,14,PRIVADO NO BENÉFICO,23,PRIVADO NO BENÉFICO,N,N,N,,N,N,N,,N,administraccion@grupoperezespinosa.com,0,0,0,0,0,0,0,0,0,0,0,0,0,"LG SANTA ROSA, Nº 6,Llanera,033690","Santa Rosa, CA, United States","(38.439697265625, -122.71564483642578, 0.0)",38.439697265625,-122.71564483642578,0.0
330332,CLÍNICA PSIQUIÁTRICA SOMIÓ,CARRETERA LA PROVIDENCIA-INFANZÓN 3518,985133806.0,,985132278.0,330241,Gijón,33,ASTURIAS,3,PPDO. DE ASTURIAS,033203,40,6,PSIQUIÁTRICO,14,PRIVADO NO BENÉFICO,23,PRIVADO NO BENÉFICO,N,N,N,,N,N,N,,N,vanesa@clinicasomio.es,0,0,0,0,0,0,0,0,0,0,0,0,0,"CARRETERA LA PROVIDENCIA-INFANZÓN 3518,Gijón,033203","Carretera de La Providencia 3518, Gijón, Principado de Asturias 33394, Spain","(43.5457572, -5.6097656, 0.0)",43.5457572,-5.6097656,0.0
330343,CLÍNICA CIRUGÍA PLÁSTICA Y ESTÉTICA FERNÁNDEZ Y FERNÁNDEZ COSSÍO,"BIMENES,18",985220244.0,,,330447,Oviedo,33,ASTURIAS,3,PPDO. DE ASTURIAS,033006,3,2,QUIRÚRGICO,14,PRIVADO NO BENÉFICO,23,PRIVADO NO BENÉFICO,N,N,N,,N,N,S,,N,info@clinicafernandez.com,0,0,0,0,0,0,0,0,0,0,0,0,0,"BIMENES,18,Oviedo,033006","Calle de Bimenes 18, Oviedo, Principado de Asturias 33006, Spain","(43.3503127, -5.8593773, 0.0)",43.3503127,-5.8593773,0.0
330354,HOSPITAL GIJÓN,AVDA. DE LA COSTA 45,985360612.0,985360613.0,984840128.0,330241,Gijón,33,ASTURIAS,3,PPDO. DE ASTURIAS,033201,32,13,GERIATRÍA Y/O LARGA ESTANCIA,14,PRIVADO NO BENÉFICO,23,PRIVADO NO BENÉFICO,N,N,N,,N,N,N,,N,info@hospitalgijon.es,0,0,0,0,0,0,0,0,0,0,0,0,0,"AVDA. DE LA COSTA 45,Gijón,033201","Avenida de la Costa, General Alvarado, Buenos Aires Province, Argentina","(-38.2426, -57.78048, 0.0)",-38.2426,-57.78048,0.0
330365,CENTRO TERAPÉUTICO VISTA ALEGRE,AVDA. PROFESOR PÉREZ PIMENTEL 30 LA GUÍA-SOMIÓ,985363435.0,985771677.0,985772566.0,330241,Gijón,33,ASTURIAS,3,PPDO. DE ASTURIAS,033203,28,6,PSIQUIÁTRICO,14,PRIVADO NO BENÉFICO,23,PRIVADO NO BENÉFICO,N,N,N,,N,N,N,,N,administracion@grupoperezespinosa.com,0,0,0,0,0,0,0,0,0,0,0,0,0,"AVDA. PROFESOR PÉREZ PIMENTEL 30 LA GUÍA-SOMIÓ,Gijón,033203","Avenida del Profesor Pérez Pimentel 30, Gijón, Principado de Asturias 33203, Spain","(43.532403185330814, -5.628402119144348, 0.0)",43.532403185330814,-5.628402119144348,0.0
330376,INSTITUTO OFTALMOLÓGICO FERNÁNDEZ -VEGA,"AVDA. DOCTORES FERNÁNDEZ-VEGA, 34",985241512.0,,985231254.0,330447,Oviedo,33,ASTURIAS,3,PPDO. DE ASTURIAS,033012,13,9,OFTÁLMICO U ORL,14,PRIVADO NO BENÉFICO,23,PRIVADO NO BENÉFICO,N,N,N,,N,N,S,,N,instituto@fernandez-vega.com,0,0,0,0,0,0,0,0,0,0,0,0,0,"AVDA. DOCTORES FERNÁNDEZ-VEGA, 34,Oviedo,033012","Oviedo, FL, United States","(28.670289993286133, -81.20848083496094, 0.0)",28.670289993286133,-81.20848083496094,0.0
340014,HOSPITAL RIO CARRIÓN,"AV. DONANTES DE SANGRE, S/N",979167000.0,,979167014.0,341202,Palencia,34,PALENCIA,7,CASTILLA Y LEÓN,034005,0,1,GENERAL,1,SEGURIDAD SOCIAL,35,SANIDAD CASTILLA Y LEÓN-SACYL,S,N,S,340063.0,N,N,S,,N,gerente.hrcr@saludcastillayleon.es,0,0,0,0,0,0,0,0,0,0,0,0,0,"AV. DONANTES DE SANGRE, S/N,Palencia,034005","Avenida de los Donantes de Sangre, Palencia, Castilla y León 34005, Spain","(42.0027590530884, -4.53679083348238, 0.0)",42.0027590530884,-4.53679083348238,0.0
340029,HOSPITAL SAN TELMO,"AV. SAN TELMO, S/N",979167000.0,,979167014.0,341202,Palencia,34,PALENCIA,7,CASTILLA Y LEÓN,034004,0,1,GENERAL,7,DIPUTACIÓN O CABILDO,35,SANIDAD CASTILLA Y LEÓN-SACYL,S,N,S,340063.0,N,N,S,,N,gerente.hrcr@saludcastillayleon.es,0,0,0,0,0,0,0,0,0,0,0,0,0,"AV. SAN TELMO, S/N,Palencia,034004","Avenida de San Telmo, Palencia, Castilla y León 34004, Spain","(41.9985136914788, -4.52386914713679, 0.0)",41.9985136914788,-4.52386914713679,0.0
340035,HOSPITAL PSIQUIATRICO SAN LUIS,"CTRA. DE BURGOS, S/N",979165324.0,,979165443.0,341202,Palencia,34,PALENCIA,7,CASTILLA Y LEÓN,034004,206,6,PSIQUIÁTRICO,12,PRIVADO-BENÉFICO (IGLESIA),21,PRIVADO-BENÉFICO (IGLESIA),N,N,N,,N,N,S,,N,ch.palencia@hospitalarias.es,0,0,0,0,0,0,0,0,0,0,0,0,0,"CTRA. DE BURGOS, S/N,Palencia,034004","Palencia, Castilla and Leon, Spain","(42.01245880126953, -4.531175136566162, 0.0)",42.01245880126953,-4.531175136566162,0.0
340040,ÁREA PSIQUIÁTRICA DEL CENTRO ASISTENCIAL SAN JUAN DE DIOS,"PS. PADRE FAUSTINO CALVO, 46",979742300.0,,979742890.0,341202,Palencia,34,PALENCIA,7,CASTILLA Y LEÓN,034005,97,6,PSIQUIÁTRICO,12,PRIVADO-BENÉFICO (IGLESIA),21,PRIVADO-BENÉFICO (IGLESIA),N,N,N,,N,N,S,,S,palencia.hospital@hsjd.es,0,0,0,0,0,0,0,0,0,0,0,0,0,"PS. PADRE FAUSTINO CALVO, 46,Palencia,034005","Paseo de Padre Faustino Calvo 46, Palencia, Castilla y León 34005, Spain","(42.0007641, -4.5507731, 0.0)",42.0007641,-4.5507731,0.0
340053,HOSPITAL RECOLETAS DE PALENCIA,"AV. SIMÓN NIETO, 31-34",979747700.0,,979703329.0,341202,Palencia,34,PALENCIA,7,CASTILLA Y LEÓN,034005,44,1,GENERAL,14,PRIVADO NO BENÉFICO,23,PRIVADO NO BENÉFICO,N,N,N,,N,N,S,,S,admision.hrp@gruporecoletas.com,2,1,0,0,0,0,0,0,0,0,1,1,0,"AV. SIMÓN NIETO, 31-34,Palencia,034005","Avenida de Simón Nieto 31, Palencia, Castilla y León 34005, Spain","(42.0158636, -4.5401603, 0.0)",42.0158636,-4.5401603,0.0
340063,COMPLEJO ASISTENCIAL UNIVERSITARIO DE PALENCIA,"AV. DONANTES DE SANGRE, S/N",979167000.0,,979167014.0,341202,Palencia,34,PALENCIA,7,CASTILLA Y LEÓN,034005,495,1,GENERAL,9,ENTIDADES PÚBLICAS,35,SANIDAD CASTILLA Y LEÓN-SACYL,S,S,N,,N,N,S,,N,gerente.hrcr@saludcastillayleon.es,2,1,0,0,0,0,0,0,0,0,3,1,17,"AV. DONANTES DE SANGRE, S/N,Palencia,034005","Avenida de los Donantes de Sangre, Palencia, Castilla y León 34005, Spain","(42.0027590530884, -4.53679083348238, 0.0)",42.0027590530884,-4.53679083348238,0.0
350043,HOSPITAL UNIVERSITARIO MATERNO-INFANTIL DE CANARIAS,"AV. MARÍTIMA DEL SUR, S/N",928444400.0,,928444732.0,350167,"Palmas de Gran Canaria, Las",35,LAS PALMAS,5,CANARIAS,035016,0,5,MATERNO-INFANTIL,1,SEGURIDAD SOCIAL,8,SERVICIO CANARIO DE SALUD,S,N,S,350290.0,N,N,S,,N,gerenchuimi.scs@gobiernodecanarias.org,0,0,0,0,0,0,0,0,0,0,0,0,0,"AV. MARÍTIMA DEL SUR, S/N,Palmas de Gran Canaria, Las,035016","Avenida Marítima del Sur, Las Palmas de Gran Canaria, Canarias 35016, Spain","(28.07210194373, -15.4165842204644, 0.0)",28.07210194373,-15.4165842204644,0.0
350056,HOSPITAL UNIVERSITARIO INSULAR DE GRAN CANARIA,"AV MARÍTIMA DEL SUR, S/N",928444000.0,928445000.0,928444732.0,350167,"Palmas de Gran Canaria, Las",35,LAS PALMAS,5,CANARIAS,035016,0,1,GENERAL,6,COMUNIDAD AUTÓNOMA,8,SERVICIO CANARIO DE SALUD,S,N,S,350290.0,N,N,S,,N,gerenchuimi.scs@gobiernodecanarias.org,0,0,0,0,0,0,0,0,0,0,0,0,0,"AV MARÍTIMA DEL SUR, S/N,Palmas de Gran Canaria, Las,035016","Autopista del Sur, Santa Cruz de Tenerife, Canarias 38111, Spain","(28.4319030504838, -16.2937816001632, 0.0)",28.4319030504838,-16.2937816001632,0.0
350069,UNIDADES CLÍNICAS Y DE REHABILITACIÓN (UCYR),"REAL DEL CASTILLO, 152",928303834.0,,,350167,"Palmas de Gran Canaria, Las",35,LAS PALMAS,5,CANARIAS,035014,0,6,PSIQUIÁTRICO,6,COMUNIDAD AUTÓNOMA,8,SERVICIO CANARIO DE SALUD,N,N,S,350332.0,N,N,S,,N,hospitaldrnegrin@gobiernodecanarias.org,0,0,0,0,0,0,0,0,0,0,0,0,0,"REAL DEL CASTILLO, 152,Palmas de Gran Canaria, Las,035014","Calle Real del Castillo, Las Palmas de Gran Canaria, Canarias 35014, Spain","(28.1018730001457, -15.4230869500893, 0.0)",28.1018730001457,-15.4230869500893,0.0
350081,SANATORIO DERMATOLÓGICO REGIONAL,"HOYA DEL PARRADO, 2 (TAFIRA ALTA)",928350354.0,,928350100.0,350167,"Palmas de Gran Canaria, Las",35,LAS PALMAS,5,CANARIAS,035017,54,13,GERIATRÍA Y/O LARGA ESTANCIA,7,DIPUTACIÓN O CABILDO,16,DIPUTACIÓN O CABILDO,N,N,N,,N,N,S,,S,rosafr@instituto-as.es,0,0,0,0,0,0,0,0,0,0,0,0,0,"HOYA DEL PARRADO, 2 (TAFIRA ALTA),Palmas de Gran Canaria, Las,035017","Plaza de Tafira Alta 2, Las Palmas de Gran Canaria, Canarias 35017, Spain","(28.0580126, -15.4611099, 0.0)",28.0580126,-15.4611099,0.0
350115,FUNDACIÓN BENÉFICA CANARIA CASA ASILO SAN JOSÉ,"PADRE CUETO, 26",928263708.0,928263720.0,928264393.0,350167,"Palmas de Gran Canaria, Las",35,LAS PALMAS,5,CANARIAS,035008,66,1,GENERAL,13,OTRO PRIVADO BENÉFICO,22,OTRO PRIVADO-BENÉFICO,N,N,N,,N,N,S,,S,ifernandez@hospitalsanjose.es,0,0,0,0,0,0,0,0,0,0,1,0,0,"PADRE CUETO, 26,Palmas de Gran Canaria, Las,035008","Calle Padre Cueto 26, Las Palmas de Gran Canaria, Canarias 35008, Spain","(28.1430838, -15.4325656, 0.0)",28.1430838,-15.4325656,0.0
350120,VITHAS HOSPITAL SANTA CATALINA,"LEÓN Y CASTILLO, 292",928297151.0,,928233485.0,350167,"Palmas de Gran Canaria, Las",35,LAS PALMAS,5,CANARIAS,035005,152,1,GENERAL,14,PRIVADO NO BENÉFICO,23,PRIVADO NO BENÉFICO,N,N,N,,N,N,S,,S,infolaspalmas@vithas.es,1,2,0,1,1,1,0,0,0,0,1,1,0,"LEÓN Y CASTILLO, 292,Palmas de Gran Canaria, Las,035005","Calle León y Castillo 292, Las Palmas de Gran Canaria, Canarias 35005, Spain","(28.1268036, -15.4297876, 0.0)",28.1268036,-15.4297876,0.0
350154,"HOSPITAL POLICLÍNICO LA PALOMA, S.A.","MAESTRO VALLE, 20",928234466.0,691237088.0,928242840.0,350167,"Palmas de Gran Canaria, Las",35,LAS PALMAS,5,CANARIAS,035005,108,1,GENERAL,14,PRIVADO NO BENÉFICO,23,PRIVADO NO BENÉFICO,N,N,N,,N,N,S,,S,fernandojimenezdelcampo@hospitallapaloma.com,1,1,0,0,0,0,0,0,0,0,1,0,0,"MAESTRO VALLE, 20,Palmas de Gran Canaria, Las,035005","Calle Maestro Valle 20, Las Palmas de Gran Canaria, Canarias 35005, Spain","(28.1264928, -15.4322432, 0.0)",28.1264928,-15.4322432,0.0
350167,"INSTITUTO POLICLÍNICO CAJAL, S.L.","SENADOR CASTILLO OLIVARES, 15",928369166.0,928369366.0,928363475.0,350167,"Palmas de Gran Canaria, Las",35,LAS PALMAS,5,CANARIAS,035003,136,1,GENERAL,14,PRIVADO NO BENÉFICO,23,PRIVADO NO BENÉFICO,N,N,N,,N,N,S,,S,info@clinicacajal.es,1,1,0,0,0,0,0,0,0,0,1,0,0,"SENADOR CASTILLO OLIVARES, 15,Palmas de Gran Canaria, Las,035003","Calle Senador Castillo Olivares 15, Las Palmas de Gran Canaria, Canarias 35003, Spain","(28.1100226, -15.421425, 0.0)",28.1100226,-15.421425,0.0
350173,HOSPITAL SAN ROQUE LAS PALMAS DE GRAN CANARIA,"DOLORES DE LA ROCHA, 5",928012630.0,928012615.0,928316048.0,350167,"Palmas de Gran Canaria, Las",35,LAS PALMAS,5,CANARIAS,035001,162,1,GENERAL,14,PRIVADO NO BENÉFICO,23,PRIVADO NO BENÉFICO,N,N,N,,N,N,S,,S,direccionmedica@hospitalessanroque.com,1,2,3,1,1,1,0,1,3,1,1,1,0,"DOLORES DE LA ROCHA, 5,Palmas de Gran Canaria, Las,035001","Calle Dolores de la Rocha 5, Las Palmas de Gran Canaria, Canarias 35001, Spain","(28.0990195, -15.4133842, 0.0)",28.0990195,-15.4133842,0.0
350192,CLÍNICA BANDAMA,"LA TORNERA, 16 (TAFIRA ALTA)",928350050.0,928350054.0,928353264.0,350167,"Palmas de Gran Canaria, Las",35,LAS PALMAS,5,CANARIAS,035017,64,6,PSIQUIÁTRICO,14,PRIVADO NO BENÉFICO,23,PRIVADO NO BENÉFICO,N,N,N,,N,N,S,,N,bandama@clinicabandama.com,0,0,0,0,0,0,0,0,0,0,0,0,0,"LA TORNERA, 16 (TAFIRA ALTA),Palmas de Gran Canaria, Las,035017","Carretera de Tafira Alta 16, Las Palmas de Gran Canaria, Canarias 35017, Spain","(28.067389, -15.4569017, 0.0)",28.067389,-15.4569017,0.0
350206,HOSPITAL NUESTRA SEÑORA DEL PERPETUO SOCORRO,"LEÓN Y CASTILLO, 407",928499900.0,928499910.0,928266627.0,350167,"Palmas de Gran Canaria, Las",35,LAS PALMAS,5,CANARIAS,035007,187,1,GENERAL,14,PRIVADO NO BENÉFICO,23,PRIVADO NO BENÉFICO,N,N,N,,N,N,S,,S,jpetit@hpshospitales.com,1,2,0,1,1,0,0,0,0,0,1,1,0,"LEÓN Y CASTILLO, 407,Palmas de Gran Canaria, Las,035007","Calle León y Castillo 407, Las Palmas de Gran Canaria, Canarias 35007, Spain","(28.137408, -15.4301996, 0.0)",28.137408,-15.4301996,0.0
350228,HOSPITAL DOCTOR JOSÉ MOLINA OROSA,"CTRA. ARRECIFE-TINAJO, KM. 1,3",928595103.0,,928815034.0,350043,Arrecife,35,LAS PALMAS,5,CANARIAS,035500,292,1,GENERAL,1,SEGURIDAD SOCIAL,8,SERVICIO CANARIO DE SALUD,S,N,N,,N,N,N,,N,ftolrod@gobiernodecanarias.org,1,1,0,0,0,0,0,0,0,0,1,0,9,"CTRA. ARRECIFE-TINAJO, KM. 1,3,Arrecife,035500","Carretera Arrecife a Tinajo 1, San Bartolomé, Canarias 35550, Spain","(29.0034658, -13.6094474, 0.0)",29.0034658,-13.6094474,0.0
350249,HOSPITAL INSULAR DE LANZAROTE,"JUAN DE QUESADA, S/N",928810000.0,,928812263.0,350043,Arrecife,35,LAS PALMAS,5,CANARIAS,035500,80,13,GERIATRÍA Y/O LARGA ESTANCIA,7,DIPUTACIÓN O CABILDO,16,DIPUTACIÓN O CABILDO,S,N,N,,N,N,N,,S,domingodeguzman@cabildodelanzarote.com,0,0,0,0,0,0,0,0,0,0,0,0,0,"JUAN DE QUESADA, S/N,Arrecife,035500","Arrecife, Canary Islands, Spain","(28.95950698852539, -13.547600746154785, 0.0)",28.95950698852539,-13.547600746154785,0.0
350252,HOSPITAL GENERAL DE FUERTEVENTURA,"CTRA. AEROPUERTO, KM. 1",928862000.0,928862298.0,928862137.0,350173,Puerto del Rosario,35,LAS PALMAS,5,CANARIAS,035600,131,1,GENERAL,6,COMUNIDAD AUTÓNOMA,8,SERVICIO CANARIO DE SALUD,S,N,N,,N,N,N,,N,gerenciafue.scs@gobiernodecanarias.org,1,1,0,0,0,0,0,0,0,0,1,0,14,"CTRA. AEROPUERTO, KM. 1,Puerto del Rosario,035600","Carretera Aeropuerto, Puerto del Rosario, Canarias 35600, Spain","(28.4955146681245, -13.8647369661924, 0.0)",28.4955146681245,-13.8647369661924,0.0
350265,"QUINTA MÉDICA DE REPOSO, S.A.","PALMA ROMERO, 7",928640050.0,,928641407.0,350213,Santa Brígida,35,LAS PALMAS,5,CANARIAS,035300,78,6,PSIQUIÁTRICO,14,PRIVADO NO BENÉFICO,23,PRIVADO NO BENÉFICO,N,N,N,,N,N,N,,N,admision@quintamedica.com,0,0,0,0,0,0,0,0,0,0,0,0,0,"PALMA ROMERO, 7,Santa Brígida,035300","Camino Palma Romero 7, Santa Brígida, Canarias 35308, Spain","(28.02915766645245, -15.499776912405993, 0.0)",28.02915766645245,-15.499776912405993,0.0
350271,HOSPITAL DE SAN ROQUE GUÍA,"CUESTA DE CARABALLO, 1",928882000.0,,928888221.0,350234,Santa María de Guía de Gran Canaria,35,LAS PALMAS,5,CANARIAS,035450,0,13,GERIATRÍA Y/O LARGA ESTANCIA,6,COMUNIDAD AUTÓNOMA,8,SERVICIO CANARIO DE SALUD,N,N,S,350332.0,N,N,N,,N,hospitaldrnegrin@gobiernodecanarias.org,0,0,0,0,0,0,0,0,0,0,0,0,0,"CUESTA DE CARABALLO, 1,Santa María de Guía de Gran Canaria,035450","Lugar Diseminado Cuesta de Caraballo 1, Santa María de Guía de Gran Canaria, Canarias 35457, Spain","(28.129371751149304, -15.625778230403384, 0.0)",28.129371751149304,-15.625778230403384,0.0
350287,HOSPITAL CIUDAD DE TELDE,"MISTER BLISSE, S/N  URB. LA ESTRELLA",928707555.0,,928707554.0,350265,Telde,35,LAS PALMAS,5,CANARIAS,035212,219,13,GERIATRÍA Y/O LARGA ESTANCIA,14,PRIVADO NO BENÉFICO,23,PRIVADO NO BENÉFICO,N,N,N,,N,N,N,,S,contabilidad.hct@grupoicot.es,1,1,0,0,0,0,0,0,0,0,0,0,0,"MISTER BLISSE, S/N  URB. LA ESTRELLA,Telde,035212","Telde, Canary Islands, Spain","(28.01481056213379, -15.384244918823242, 0.0)",28.01481056213379,-15.384244918823242,0.0
350290,COMPLEJO HOSPITALARIO UNIVERSITARIO INSULAR-MATERNO INFANTIL,"AV. MARÍTIMA DEL SUR, S/N",928444000.0,928445000.0,928444732.0,350167,"Palmas de Gran Canaria, Las",35,LAS PALMAS,5,CANARIAS,035016,916,1,GENERAL,6,COMUNIDAD AUTÓNOMA,8,SERVICIO CANARIO DE SALUD,S,S,N,,N,N,S,,N,gerenchuimi.scs@gobiernodecanarias.org,3,2,3,1,2,1,0,0,3,0,3,1,20,"AV. MARÍTIMA DEL SUR, S/N,Palmas de Gran Canaria, Las,035016","Avenida Marítima del Sur, Las Palmas de Gran Canaria, Canarias 35016, Spain","(28.07210194373, -15.4165842204644, 0.0)",28.07210194373,-15.4165842204644,0.0
350304,HOSPITAL CLÍNICA ROCA (ROCA GESTIÓN HOSPITALARIA),"BUGANVILLA, 1 (SAN AGUSTÍN)",928769004.0,,928761248.0,350192,San Bartolomé de Tirajana,35,LAS PALMAS,5,CANARIAS,035100,81,1,GENERAL,14,PRIVADO NO BENÉFICO,23,PRIVADO NO BENÉFICO,N,N,N,,N,N,N,,S,info@clinicaroca.com,1,1,0,0,0,0,0,0,0,0,2,1,6,"BUGANVILLA, 1 (SAN AGUSTÍN),San Bartolomé de Tirajana,035100","Paseo de Playa San Agustín 1, San Bartolomé de Tirajana, Canarias 35100, Spain","(27.767711760805145, -15.549743481802748, 0.0)",27.767711760805145,-15.549743481802748,0.0
350311,HOSPITAL UNIVERSITARIO  DE GRAN CANARIA DR. NEGRÍN,"BARRANCO DE LA BALLENA, S/N",928450001.0,928450108.0,928449085.0,350167,"Palmas de Gran Canaria, Las",35,LAS PALMAS,5,CANARIAS,035010,0,1,GENERAL,6,COMUNIDAD AUTÓNOMA,8,SERVICIO CANARIO DE SALUD,S,N,S,350332.0,N,N,S,,N,hospitaldrnegrin@gobiernodecanarias.org,0,0,0,0,0,0,0,0,0,0,0,0,0,"BARRANCO DE LA BALLENA, S/N,Palmas de Gran Canaria, Las,035010","Barranco de la Ballena, Las Palmas de Gran Canaria, Canarias 35019, Spain","(28.1201161429062, -15.4430894927331, 0.0)",28.1201161429062,-15.4430894927331,0.0
350326,HOSPITEN LANZAROTE (CLÍNICAS DEL SUR S.L.U.),"LOMO GORDO, S/N",928596100.0,,928515635.0,350287,Tías,35,LAS PALMAS,5,CANARIAS,035510,61,1,GENERAL,14,PRIVADO NO BENÉFICO,23,PRIVADO NO BENÉFICO,N,N,N,,N,N,N,,S,lanzarote@hospiten.com,1,1,0,0,0,0,0,0,0,0,1,1,0,"LOMO GORDO, S/N,Tías,035510","San Bartolomé de Tirajana, Canary Islands, Spain","(27.78080177307129, -15.602523803710938, 0.0)",27.78080177307129,-15.602523803710938,0.0
350332,COMPLEJO HOSPITALARIO UNIVERSITARIO DE GRAN CANARIA DR. NEGRÍN,BARRANCO DE LA BALLENA S/N,928450001.0,,928449085.0,350167,"Palmas de Gran Canaria, Las",35,LAS PALMAS,5,CANARIAS,035010,828,1,GENERAL,6,COMUNIDAD AUTÓNOMA,8,SERVICIO CANARIO DE SALUD,S,S,N,,N,N,S,,N,hospitaldrnegrin@gobiernodecanarias.org,2,2,2,3,4,1,0,5,2,1,1,1,89,"BARRANCO DE LA BALLENA S/N,Palmas de Gran Canaria, Las,035010","Barranco de la Ballena, Las Palmas de Gran Canaria, Canarias 35019, Spain","(28.1201161429062, -15.4430894927331, 0.0)",28.1201161429062,-15.4430894927331,0.0
350367,HOSPITAL SAN ROQUE MASPALOMAS,"MAR DE SIBERIA, 1",928063600.0,,928063644.0,350192,San Bartolomé de Tirajana,35,LAS PALMAS,5,CANARIAS,035100,147,1,GENERAL,8,MUNICIPIO,23,PRIVADO NO BENÉFICO,N,N,N,,N,N,N,,S,sebastian.sanso@hospitalessanroque.com,1,1,0,0,0,1,0,0,0,0,1,1,14,"MAR DE SIBERIA, 1,San Bartolomé de Tirajana,035100","Calle del Mar de Siberia 1, San Bartolomé de Tirajana, Canarias 35100, Spain","(27.7499328, -15.6077173, 0.0)",27.7499328,-15.6077173,0.0
350389,CLÍNICA PARQUE FUERTEVENTURA,"LEÓN Y CASTILLO, ESQ. SECUNDINO ALONSO, S/N",928851500.0,,928532113.0,350173,Puerto del Rosario,35,LAS PALMAS,5,CANARIAS,035600,12,12,MÉDICO-QUIRÚRGICO,14,PRIVADO NO BENÉFICO,23,PRIVADO NO BENÉFICO,S,N,N,,N,N,N,,N,fuerteventura@parquehospitales.es,1,1,0,0,0,0,0,0,0,0,1,0,0,"LEÓN Y CASTILLO, ESQ. SECUNDINO ALONSO, S/N,Puerto del Rosario,035600","Puerto del Rosario, Canary Islands, Spain","(28.496503829956055, -13.86220645904541, 0.0)",28.496503829956055,-13.86220645904541,0.0
350390,CLINICA JORGANI,AVDA ISLAS CANARIAS 5. C.C. CALIPSO.,928346868.0,,928346363.0,350249,Teguise,35,LAS PALMAS,5,CANARIAS,035508,11,1,GENERAL,14,PRIVADO NO BENÉFICO,23,PRIVADO NO BENÉFICO,N,N,N,,N,N,N,,N,recepcion@cmjorgani.com,0,0,0,0,0,0,0,0,0,0,0,0,0,"AVDA ISLAS CANARIAS 5. C.C. CALIPSO.,Teguise,035508","Canary Islands, Spain","(28.290523529052734, -16.55661964416504, 0.0)",28.290523529052734,-16.55661964416504,0.0
360010,HOSPITAL UNIVERSITARIO MONTECELO,"MOURENTE, S/N",986800000.0,,986800004.0,360388,Pontevedra,36,PONTEVEDRA,12,GALICIA,036071,0,1,GENERAL,9,ENTIDADES PÚBLICAS,7,SERVICIO GALLEGO DE SALUD-SERGAS,S,N,S,360340.0,N,N,S,,N,,0,0,0,0,0,0,0,0,0,0,0,0,0,"MOURENTE, S/N,Pontevedra,036071","Pontevedra, Galicia, Spain","(42.43357467651367, -8.648114204406738, 0.0)",42.43357467651367,-8.648114204406738,0.0
360025,HOSPITAL PROVINCIAL DE PONTEVEDRA,"DOCTOR LOUREIRO CRESPO, 002",986800000.0,,986800001.0,360388,Pontevedra,36,PONTEVEDRA,12,GALICIA,036004,0,1,GENERAL,9,ENTIDADES PÚBLICAS,7,SERVICIO GALLEGO DE SALUD-SERGAS,S,N,S,360340.0,N,N,S,,N,,0,0,0,0,0,0,0,0,0,0,0,0,0,"DOCTOR LOUREIRO CRESPO, 002,Pontevedra,036004","Pontevedra, Galicia, Spain","(42.43357467651367, -8.648114204406738, 0.0)",42.43357467651367,-8.648114204406738,0.0
360031,HESTIA SANTA MARIA,"SANTA MARIA (DE), 9",986856562.0,610527859.0,986853619.0,360388,Pontevedra,36,PONTEVEDRA,12,GALICIA,036002,70,13,GERIATRÍA Y/O LARGA ESTANCIA,14,PRIVADO NO BENÉFICO,23,PRIVADO NO BENÉFICO,N,N,N,,N,N,S,,S,HESTIASANTAMARIA@HESTIASANTAMARIA.ORG,0,0,0,0,0,0,0,0,0,0,0,0,0,"SANTA MARIA (DE), 9,Pontevedra,036002","Calle Santa María 9, San Cristóbal de la Laguna, Canarias 38108, Spain","(28.441686, -16.2991477, 0.0)",28.441686,-16.2991477,0.0
